112,DEN,Courtland Sutton,WR,11.03,12,30.5,204,536,839,"1,383","Sutton ended 2025 as the WR22 in PPR points per game, benefiting from a high-volume passing attack. He remains locked into the X role for HC Sean Payton, especially after signing a new deal that keeps him with the Broncos through 2029. At 31 in October, however, Sutton's likely closer to a decline than he is to his peak. Jaylen Waddle also arrived in an offseason deal, a move that figures to lower Sutton's target volume.",16
113,JAC,Brenton Strange,TE,10.01,8,25.3,191,456,725,"1,259","Strange replaced Evan Engram with success in HC Liam Coen's offense. A quad injury did sideline him for 6 games, but he finished the year with three top-7 TE performances in his last five games. Strange should be locked in as the TE starter going forward for Coen and the Jaguars, making him a solid young TE to roster at only 25 years old.",16
114,SF,Mike Evans,WR,10.10,14,32.7,212,561,825,"1,316","Evans battled injuries in 2025 and lost his 1,000-yard receiving streak. He will turn 33 before next season, so Evans' career is certainly on the downside. That said, he landed in a fine spot for short-term production with the 49ers. They lost 101 targets via offseason departures.",16
115,BUF,D.J. Moore,WR,8.05,7,29,195,533,834,"1,410","Moore was inconsistent under new HC Ben Johnson. He ended the season going 50-682-6, his worst fantasy output since 2018. GM Ryan Poles then traded Moore to the Bills in March. The 29-year-old should see greater target stability in Buffalo alongside Josh Allen. A WR2 season is within reach for 2026.",16
116,JAC,Travis Hunter,WR,10.03,8,22.9,100,515,873,"1,703","Just when Hunter finally had his breakout game (8/101/1) against the Rams, he suffered a knee injury in practice that ultimately ended his rookie campaign. That Week 7 game was his only performance with double-digit fantasy points. 37% of Hunter's snaps came as a CB, which will always be a concern. Additionally, the Jaguars traded for (and extended) Jakboi Meyers and also have Brian Thomas Jr. to syphon targets away from Hunter. Volume, usage, and now, injury, are all concerns for Hunter, making him a risk/reward WR3 in his second season.",16
117,TEN,Wan'Dale Robinson,WR,9.02,10,25.3,176,517,829,"1,508","Robinson excelled after Malik Nabers' season ended early in 2025. Robinson finished WR17 in PPR points per game and had his second straight season with 140 targets. He signed with Tennessee in free agency, reuniting him with former HC Brian Daboll (now the Titans' OC). Don't expect 140 targets, but volume shouldn't be an issue in a wide-open Tennessee WR corps.",16
118,PHI,Dallas Goedert,TE,14.04,9,31.3,189,463,712,"1,181","Goedert had a TD-heavy 2025 going 60-591-11. The Eagles schemed up red zone touches for him to score as much as he did, but that may not happen in the future. Goedert is set to be a free agent in 2026, but he is unlikely to find a better situation than the Eagles. He will be 31 heading into the 2026 season and may have peaked in terms of his fantasy output.",15
119,JAC,Bhayshul Tuten,RB,8.11,8,24.2,171,343,532,921,"Tuten carried the Virginia Tech offense for two years after transferring from North Carolina A&T. He showed excellent speed and vision while adding return value. He posted elite numbers at the NFL Combine as the fastest RB in the 40-yard dash, running a 4.32. He also had the best Vertical (40.5""). We saw his burst appear as a rookie, although he never overtook Travis Etienne as the lead back. There's a chance for a larger role in 2026 with Etienne in New Orleans, but the Jags may opt for a committee with Chris Rodriguez and LeQuint Allen.",15
120,CHI,D'Andre Swift,RB,9.03,5,27.3,222,395,486,666,"Swift's 2023 in Philly proved inconsistent, but he ultimately set career highs in touches and yardage. Chicago provided a fine free agent spot for volume, but a poorly orchestrated offense and a weak O-line limited the fantasy impact. The offensive infrastructure changed alongside new HC Ben Johnson in 2025. As a result, Swift rebounded to finish as the PPR RB14, despite the emergence of Kyle Monangai. The veteran is under contract for one more season.",15
121,PIT,Jaylen Warren,RB,10.08,5,27.4,212,359,521,726,"Najee Harris departed in free agency last spring. But Warren was far from a workhorse after free agent addition Kenneth Gainwell took on a larger-than-expected role. Warren still proved useful with a PPR RB18 finish in 16 games. Gainwell left in free agency, but the Steelers confirmed that they don't want Warren in a workhorse role by signing Rico Dowdle.",15
122,GB,Matthew Golden,WR,11.04,5,22.7,156,485,810,"1,554","Golden had a disappointing rookie season as a first-round WR, finishing 2025 as WR113 in PPR points per game (5.0). Golden couldn't really crack a deep WR group but will get another opportunity in 2026, especially with Romeo Doubs in New England. The second-year pro turns just 23 before next season.",14
123,BUF,Khalil Shakir,WR,13.02,7,26.2,174,495,799,"1,456","Shakir ended last season as WR35 in PPR, with the Bills' inconsistent passing attack hurting his overall output. He's signed through 2029 and should be locked into the slot role moving forward. The issue is that his ceiling took a hit this offseason with the arrival of D.J. Moore. Based on his contract, the former Bear is likely to stick in Buffalo for at least two seasons.",14
124,NE,Romeo Doubs,WR,11.12,14,26,191,487,786,"1,432","Doubs continued his high snap counts as a starter in 2025, but the depth of the Packers' pass catchers limited the ceiling. Doubs posted 55-724-6, enough to make him a spot-start WR3/Flex. New England paid up for him in free agency: a 4-year deal with $39 million in total guarantees. He should be the target leader for Drake Maye in 2026.",13
125,NYJ,Omar Cooper Jr.,WR,8.10,9,22.3,149,477,799,"1,568","Cooper led Indiana in receiving in 2025, posting a 64-866-13 line. His body control and strong hands made him a go-to option for Heisman QB Fernando Mendoza, especially in the red zone. He pairs that reliability with strong competitiveness and run-after-catch ability. The Jets traded up to select him 30th overall, making him the WR5 in this class. But the situation adds risk. Garrett Wilson remains locked in as the top target, and the Jets drafted athletic TE Kenyon Sadiq earlier in Round 1. The QB position also lacks a long-term answer.",13
126,SEA,Zach Charbonnet,RB,10.06,8,25.3,97,381,543,694,"Seattle made Charbonnet a surprising Round 2 pick, and his usage was predictably limited alongside Kenneth Walker in 2023. A 2024 breakout never truly came, although he showed workhorse potential in games missed by Walker. OC Klink Kubiak favored Charbonnet at the goal line in 2025, leading to a huge 12 rushing scores. A roadblock hit in the playoffs, as he suffered an ACL tear on January 18. His short-term value not only depends on his rehab trajectory but also on the moves Seattle makes in the backfield. So far, they've only added former Packer Emanuel Wilson.",13
127,TB,Chris Godwin,WR,12.08,9,30.1,190,510,788,"1,281","Godwin suffered a dislocated ankle that cost him most of the 2024 season. He returned a few weeks into the 2025 season but finished WR54 in PPR points per game. Godwin, now 30, should have a larger role in 2026 with Mike Evans in San Francisco.",13
128,JAC,Jakobi Meyers,WR,11.07,8,29.4,205,521,790,"1,194","Meyers moved from the Raiders to the Jaguars at the 2025 trade deadline, and he instantly excelled in HC Liam Coen's offense. Meyers' success led to the team signing him to a 3-year, $60 million contract extension. We'll see how the team deploys Travis Hunter, but Meyers' deal and production say he's a strong contender to lead this unit in 2026.",13
129,UNS,David Njoku,TE,16.06,18,29.8,148,451,756,"1,166","Njoku split time early in the season with rookie Harold Fannin Jr., but the writing was on the wall in the final year of his contract. Njoku eventually slotted behind Fannin and finished the season with 33-293-4. He enters his age-30 season looking for a new team.",13
130,JAC,Parker Washington,WR,10.02,8,24.1,199,456,778,"1,416","Washington was successful when injuries hit the Jaguars' WR corps. Including the postseason, he ended 2025 with four straight games of 9+ targets and 87+ yards. He'd benefit from the Jags making Travis Hunter anything close to a full-time DB. Still, there's starting-caliber talent in the WR room with Jakobi Meyers and Brian Thomas Jr. The Jags signed Meyers to an extension through the 2028 season.",12
131,NE,Rhamondre Stevenson,RB,12.01,14,28.2,188,334,521,706,"Stevenson was held back by a poor O-line and fumbles in 2024. Then in 2025, his workload predictably dipped following the arrival of TreVeyon Henderson. However, the veteran still posted the second-best PPR points per game tally of his career (12.9). Stevenson is under contract for three more seasons.",12
132,BAL,Mark Andrews,TE,13.09,7,30.6,169,443,702,"1,209","Andrews signed a three-year extension with the Ravens during the 2025 season, locking him into the team for the foreseeable future. With Isaiah Likely out of town, Andrews should be able to gain TE1 value in the short term. Note that 2026 will be his age-31 season.",12
133,NO,Juwan Johnson,TE,12.09,11,29.6,185,450,701,"1,128","Johnson had a career year in 2025, posting 74-828-3 on 97 targets during the fantasy season. With Shough showing promise as the starter, Johnson should retain streaming value in the short term. We're not concerned with the arrival of Noah Fant via free agency.",12
134,NE,Hunter Henry,TE,15.07,14,31.3,193,444,683,"1,133","Henry went 55-712-7 during the 2025 fantasy season, living on his ability to score TDs. He turns 32 during a contract season in 2026 but remains a short-term streamer.",12
135,CAR,Chuba Hubbard,RB,10.11,14,26.8,169,348,505,703,"Hubbard set career highs with 250 carries, 1,195 yards, and 10 TDs in 2024. Carolina rewarded him with a contract extension that November, but 2025 wasn't as fantasy-friendly. New Panther Rico Dowdle became a major backfield piece, limiting Hubbard to an RB38 PPR finish. Just note: Dowdle left for Pittsburgh in free agency. We'll see if Carolina adds another RB to join Hubbard and former Round 2 pick Jonathon Brooks.",12
136,ARI,Michael Wilson,WR,8.07,8,26.2,180,492,780,"1,330","Wilson had a marvelous late-season surge when Marvin Harrison Jr. went down and Jacoby Brissett started at QB. He ended 2025 at WR10 in PPR, going 78-1006-7. We're not doubting the talent here. But the issue is the outlook for Wilson when this offense is healthy. He's also entering a contract season.",12
137,TEN,Tony Pollard,RB,14.11,10,28.9,180,346,506,645,"Pollard earned the franchise tag in March of '23, then watched Dallas release veteran Zeke Elliott. Still, coming off a January fibula fracture, Pollard took a major step back. Pollard rebounded in 2024, outplaying Tyjae Spears and playing through injuries to post his third straight 1,000-yard season. Pollard closed the '25 season strong but struggled with consistency on a bottom-five offense. 2026 turns up a contract year.",12
138,HOU,David Montgomery,RB,9.12,6,28.8,178,320,480,807,"Montgomery's rushing yardage (716), TD output (8), and catch total (24) regressed in 2025. This, despite appearing in 17 games for the first time in his career. Ultimately, Montgomery's best fantasy days are behind him. He's signed through 2027.",12
139,GB,Jayden Reed,WR,12.03,5,25.9,187,488,770,"1,313","Reed only played seven games in 2025 due to multiple injuries, so he never broke out for a deep WR group. When active, he tallied only two top-36 fantasy finishes. 2026 turns up a contract season -- and a thinned-out WR corps following the departure of Romeo Doubs.",12
140,LAR,Blake Corum,RB,11.05,8,25.4,128,341,520,799,"Corum's rookie year came and went without much fanfare, as Kyren Williams remained a workhorse. Corum also suffered a broken forearm in January of 2025. The good news is that he earned a rotational role last fall, leading to a 145-746-6 rushing line. We expect a similar role in '26.",12
141,CLE,Denzel Boston,WR,10.04,9,22.3,156,458,775,"1,490","Boston sat behind the trio of Rome Odunze, Ja'Lynn Polk, and Jalen McMillan in 2023, but the 6'4, 210-pound WR flashed in 2024. He had his best season this year as an X WR, going 63-834-9 on a Huskies team that prioritized the run. He joins the Browns, paired with first-round pick KC Concepcion. Boston should start immediately outside and could turn into the team's top WR.",12
142,LAC,Quentin Johnston,WR,11.02,12,24.6,196,456,747,"1,397","Johnston proved 2024 wasn't a fluke. He matched his eight TDs and set career-best marks in receiving yards (735) and PPR points per game (12.4). He did so despite ranking just 41st league-wide in target share (19%). We'll see how he fits in new OC Mike McDaniels' offense, but there's room for an expanded role with Keenan Allen likely moving on.",11
143,LAC,Tre Harris,WR,14.09,12,24.1,131,481,796,"1,425","Harris struggled to crack the lineup early in his rookie season with Ladd McConkey, Keenan Allen, and Quentin Johnston in front of him. Harris' usage at least increased late in the year, while Allen's departure sets the stage for most consistent usage. Allen leaves behind 122 targets.",11
144,KC,Travis Kelce,TE,15.01,10,36.5,215,465,644,"1,038","With the Chiefs' offense taking a step back in 2005, Kelce felt the sting. He finished with 73-839-5 on his fantasy season, his lowest reception total since 2015. In March, we learned that he'd return for his 14th season in Kansas City. He's now year-to-year, making him a shaky dynasty asset.",11
145,TEN,Tyjae Spears,RB,16.10,10,24.8,155,312,484,838,"Spears looked like a 2024 breakout candidate...until Tennessee signed Tony Pollard, who held lead-back duties. That trend continued in '25, although Spears held a clear pass-catching role with 45 catches. 2026 turns up a contract season.",11
146,HOU,Woody Marks,RB,12.10,6,25.3,127,328,501,845,"Marks profiled as the ideal receiving back with over 1,400 career receiving yards in college. He is an average athlete, but ran a ton of routes at both Mississippi State and USC. However, as a rookie, Marks caught only 24 passes in 16 games. His rushing volume spiked to 196 attempts, as Nick Chubb remained underwhelming and Joe Mixon never suited up due to a foot injury. Houston added a veteran upgrade in David Montgomery over the winter, capping Marks' short-term ceiling.",11
147,HOU,Dalton Schultz,TE,15.06,6,29.8,186,442,688,"1,108","Schultz had one of his best years in 2026, going 78-704-3 during the fantasy season. He posted the most targets of his career at 106. Schultz is locked into the Texans and QB C.J. Stroud for one more season. He should be a suitable low-end TE1 for 2026, but the future is cloudy beyond that.",11
148,IND,Josh Downs,WR,12.06,11,24.7,172,454,775,"1,410","Downs flashed again in 2025, but being stuck in the slot role continued to limit his ceiling. Downs ended the season going 58-566-4 with his best games coming with Daniel Jones at QB. With Jones back in Indy and Michael Pittman in Pittsburgh, Downs should have a chance to play in more 2-WR sets. This fall turns up a contract season.",11
149,CHI,Kyle Monangai,RB,9.08,5,24.1,149,309,478,839,"Monangai posted two straight 1,200+ rushing yard seasons for a Rutgers offense that worked through him. His college tape showed a tough runner with a low pad level who works well through contact. Has also flashed on some outside runs. Those traits appeared with the Bears, as he quickly entered a timeshare with D'Andre Swift. Monangai looks poised to retain a rotational role for a young, high-upside offense in 2026.",11
150,DEN,J.K. Dobbins,RB,12.11,12,27.3,170,319,453,759,"2024 marked Dobbins’ return from an Achilles tear. He slowed down after a hot start, ultimately missing four games with an MCL sprain. In Denver, the 26-year-old landed in a fine spot for 2025 opportunity. But he suffered a notable injury again, this time a Lisfranc injury that required surgery. He signed a new deal with the Broncos in March, but durability concerns remain.",11
151,TB,Jalen McMillan,WR,13.06,9,24.3,154,454,774,"1,409","McMillan missed most of 2025 with a neck injury, but he returned late to post 7-114-0 against the Dolphins. His short-term outlook improved significantly after Mike Evans signed a multi-year deal in San Francisco.",11
152,MIN,Jordan Mason,RB,14.12,6,26.9,153,330,489,719,"Mason recorded 4.8 YPC on 159 attempts as a first-year Viking. He was a non-factor in the passing game (14 catches, 51 yards). His short-term upside remains limited with Aaron Jones returning for another season.",11
153,TB,Kenneth Gainwell,RB,13.03,9,27.1,152,317,503,730,"Gainwell was lightly used behind Saquon Barkley in 2024. The former Eagle then joined a Pittsburgh squad that watched Najee Harris sign with the Chargers. Surprisingly, Gainwell went on to pace the Steelers with a stunning 73 catches. Now, he'll push Bucky Irving for snaps and touches after signing a two-year deal in March.",11
154,WAS,Chigoziem Okonkwo,TE,15.11,12,26.6,160,439,679,"1,170","Okonkwo posted five top-12 fantasy finishes in 2025, his final year in Tennessee. He set career highs in targets (79), catches (56) and yards (560) but remained an underwhelming TD producer (2). He also played all 17 games for the fourth straight season. In Washington, he'll have a chance to boost production for an offense that's moving on from Zach Ertz.",10
155,MIN,T.J. Hockenson,TE,14.05,6,28.8,183,432,671,"1,131","Hockenson's best days are behind him as he heads into his age-29 season. The Vikings at least added talent at QB, signing Kyler Murray after enduring a brutal 2025 under J.J. McCarthy.",10
156,WAS,Jacory Croskey-Merritt,RB,13.04,12,25,122,312,478,806,"A dispute over eligibility limited Croskey-Merritt to only one game in 2024. But he flashed NFL potential in 2023 at New Mexico with 189-1,190-17. Sure enough, he showed it as a rookie. With Brian Robinson and Austin Ekeler out, JCM tallied 805 yards and 8 TDs on 175 attempts. Despite some bright moments, we expect Washington to add a backfield piece this offseason.",10
157,KC,Justin Fields,QB,18.12,10,27.1,19,584,935,"1,598","Down-to-down inconsistency remained after signing with the Jets, as Fields was eventually benched for Tyrod Taylor. Fields will likely find a backup job in 2026.",10
158,NYJ,Mason Taylor,TE,12.04,9,21.9,86,399,723,"1,427","Taylor saw playing time in his rookie season as the de facto starter for the Jets, although he only mustered 44-369-1. Neck and ankle injuries caused miss games during the season, but his playing time stayed high. While Geno Smith arrived to improve the QB spot, this passing game still profiles as a bottom-five unit.",10
159,SEA,Rashid Shaheed,WR,15.02,8,27.6,147,467,747,"1,328","Shaheed wasn't a fantasy option after arriving via a mid-season trade. Including the postseason, he topped two catches in only two of 12 games. Seattle showed their faith in him with a new contract: 3 years, $51 million, and nearly $35 million guaranteed. He projects as a volatile WR4 alongside a target hog in Jaxon Smith-Njigba.",9
160,LAR,Terrance Ferguson,TE,14.07,8,23.1,118,413,704,"1,308","Ferguson showed a late-season surge with Davante Adams sidelined. The Rams seem intent on using the young TE as a pseudo WR, which is great for his fantasy potential. Still, uncertainty at QB and a crowded TE depth chart mean dynasty managers will need patience.",9
161,SEA,Elijah Arroyo,TE,19.08,8,23,97,416,713,"1,336","Arroyo had a few flashes in his rookie season, but he was never able to rise past A.J. Barner on the depth chart. Arroyo finished the season at 15-179-1, missing the last few games with a knee injury. Still, at only 23, his athletic upside makes him a dynasty hold.",9
162,DEN,Pat Bryant,WR,15.03,12,23.3,109,445,762,"1,469","Bryant's snap share picked up as his rookie season wore on. Still, he topped 50 yards only once for an offense that lacked a consistent presence behind Courtland Sutton. Bryant's breakout path is blocked by the addition of Jaylen Waddle, who's signed through the 2028 season.",9
163,UNS,Jauan Jennings,WR,14.02,18,28.8,158,470,736,"1,243",Jennings seized the opportunity with Brandon Aiyuk out all of last season and Ricky Pearsall dealing with injuries. The veteran finished as the WR34 in PPR points per game. We'll see where he ends up in free agency.,9
164,PIT,Rico Dowdle,RB,11.09,5,27.8,162,303,475,628,"Dowdle posted a breakout 235-1,079-2 line with Dallas in 2024. He added 39 catches. That momentum continued with Carolina in 2025. Dowdle posted another 1,000-yard season while outplaying Chuba Hubbard for stretches. That work garnered attention from Pittsburgh, which signed him to a two-year deal in March. He'll enter a rotational role with Jaylen Warren in the short term.",9
165,SEA,AJ Barner,TE,13.01,8,23.9,147,418,677,"1,213","Barner played ahead of rookie Elijah Arroyo in 2025, but the young athlete may pass Barner sooner rather than later. Barner, only 24, should still remain on dynasty rosters while this situation plays out under new OC Brian Fleury.",9
166,NYJ,Braelon Allen,RB,16.02,9,22.3,65,312,501,855,"Allen’s size jumps off the tape: 6’2, 235 pounds. He averaged a robust 3.66 yards after contact per attempt for his college career, plus 5.9 yards per carry and 35 rushing scores. However, Allen didn’t show much as a pass-catcher. One silver lining: The former four-star prospect is still only 22 following a quiet 2024 and a 2025 lost to a knee injury.",9
167,UNS,Stefon Diggs,WR,17.08,18,32.3,190,484,711,"1,135","Diggs had a resurgence with the Patriots and Drake Maye in 2025, dropping 85-1013-4 in his age-32 season. But he was released by the team over the winter, as his cap figure and pending legal case sparked the move. He may not sign until the summer.",9
168,UNS,Brandon Aiyuk,WR,13.11,18,28.1,180,451,721,"1,245","Aiyuk didn't play in 2025 after an ACL, MCL, and meniscus injury in 2024. The 49ers and Aiyuk may sever ties heading into 2026, and he should be fully healthy on a new squad. Aiyuk already disappointed in 2024 before the injury and is heading into his age-28 season. It appears unlikely he turns into a top-12 fantasy WR again.",9
169,CAR,Jalen Coker,WR,12.05,14,24.4,145,438,748,"1,361","A quad injury put Coker on IR to start the 2025 season, but he succeeded when he returned. In 11 games, he went 33-394-3. Coker proved he is an ideal slot WR and played over Xavier Legette upon returning. He also made Adam Thielen expendable. Coker could retain his role going forward and be a fantasy spot-starter.",9
170,CAR,Jonathon Brooks,RB,13.10,14,22.8,125,302,472,718,"With Bijan Robinson in the pros, Brooks’ time to shine arrived in 2023. And he did, ranking top-10 nationally in yards after contact per attempt and Pro Football Focus’ elusive rating. He proved explosive as a pass-catcher, too. Just one problem: Brooks’ season ended with a November ACL tear. Then, in December of 2024, Brooks tore the same ACL again. He missed the entire 2025 season but is expected to be ready for training camp. He'll compete for touches alongside Chuba Hubbard.",8
171,TB,Cade Otton,TE,18.04,9,27,165,418,659,"1,143","Otton finished at TE29 in PPR points per game last season. The team showed they valued him with a new three-year deal worth $20 million guaranteed, but that doesn't bolster his fantasy prospects. The 27-year-old remains a low-ceiling dynasty asset.",8
172,DEN,Troy Franklin,WR,15.04,12,23.2,100,440,745,"1,426","Franklin enjoyed a mini breakout in 2025. He tallied 65-709-6 for a high-volume passing game led by Bo Nix. Unfortunately, that momentum was halted after the March trade for Jaylen Waddle. Now, Franklin will battle Pat Bryant for the No. 3 WR role.",8
173,CLE,Dylan Sampson,RB,16.11,9,21.6,132,274,458,763,"Sampson is a bit light in the pants, but he moves so fluidly, making him tough to bring down. He had six straight 100+ yard rushing games in his final season for Tennessee. Being paired on the Browns with RB Quinshon Judkins makes Samspon an intriguing third-down and pass-catching back moving forward. Sampson caught 33 of 40 targets as a rookie.",8
174,NYJ,Adonai Mitchell,WR,17.03,9,23.5,124,426,738,"1,392",Mitchell was traded from the Colts to the Jets and immediately made an impact on the weak WR unit. He finished the season with 33-453-2 and may have played his way into a role with the Jets in 2026. He's worth rostering as a dynasty stash. The former Longhorn turns just 24 in October.,8
175,NYG,Tyrone Tracy Jr.,RB,15.08,14,26.4,112,341,449,593,"Tracy delivered instant value as a rookie with 1,123 total yards, despite New York providing a terrible supporting cast. The arrow was pointing straight up... until the Giants used a Round 4 pick on bruising RB Cam Skattebo. A season-ending injury to Skattebo allowed Tracy to see more work in '25, but the pair figures to work in a timeshare in 2026.",8
176,ARI,Tyler Allgeier,RB,11.01,8,26,104,293,459,735,"Allgeier has proven effective as an early-down thumper, but Bijan Robinson capped the fantasy ceiling in Atlanta. While he’s out of Bijan’s shadow in Arizona, the Cardinals will place him in a similar situation after spending the third overall pick on Jeremiyah Love. Allgeier now projects as more of a handcuff than a standalone fantasy option.",7
177,PIT,Germie Bernard,WR,19.09,5,22.3,138,421,705,"1,374","Bernard followed HC Kalen DeBoer from Washington to Alabama. He had his best season in 2025 at 64-862-7. Bernard has good size and hands as a savvy route runner who works in the slot and outside. He may not have No. 1 WR upside, but Bernard will likely play the slot role for the Steelers. He has a low ceiling, but a high floor.",7
