164,LAR,Davante Adams,WR,9.09,8,33.3,236,577,795,"1,309","Adams had a marvelous 2025 before going down with a hamstring injury. He sat WR9 in PPR points per game and scored 14 TDs in only 14 games. Adams is signed through 2026 and will run it back with Matthew Stafford for another year. The veteran wideout should help contending teams, but he's certainly nearing the end of his career at 34 (in December).",16
165,RK,Eli Stowers,TE,11.10,18,23,135,447,763,"1,418","Stowers is a former QB converted to TE. He will be more slot WR than TE, sitting at 6'4, 235 pounds. He led Vanderbilt with 62 catches last year and was a reliable option for QB Diego Pavia. Stowers has elite explosiveness and short-area quickness, and that was reflected in his excellent Combine performance. He should sneak into Day 2 and become an impact fantasy player with enough playing time.",16
166,RK,Mansoor Delane,DB,N/A,18,22.3,undefined,402,661,1233,,16
167,KC,George Karlaftis,DL,35.12,10,25,undefined,366,615,1009,,16
168,BAL,Roquan Smith,LB,N/A,7,29,undefined,362,551,836,,16
169,DEN,Zach Allen,DL,N/A,12,28.6,undefined,401,594,828,,16
170,PIT,Michael Pittman Jr.,WR,10.09,5,28.5,210,527,843,"1,455","Pittman matched 2024's 111 targets but was much more productive in '25, snagging 11 more passes and scoring four more TDs. But he fell off down the stretch with QB Philip Rivers under center. In Indianapolis' final four games, Pittman averaged just 7.3 PPR points per game, third among the Colts' WRs. The offseason brought a trade to Pittsburgh, where he'll likely be the No. 2 option alongside DK Metcalf. It's a low-upside spot for immediate fantasy value, and the lack of a long-term answer at QB adds uncertainty.",15
171,IND,Alec Pierce,WR,8.06,11,25.9,200,535,848,"1,446","Pierce had his best season in 2025, going for 47-1003-6. He continued to produce even when Daniel Jones went down with an injury. Somewhat surprisingly, he returned to the Colts on a 4-year deal that includes a stunning $84 million in total guarantees. Michael Pittman's departure sets up Pierce for a larger role.",15
172,JAC,Brenton Strange,TE,10.01,8,25.3,191,456,725,"1,259","Strange replaced Evan Engram with success in HC Liam Coen's offense. A quad injury did sideline him for 6 games, but he finished the year with three top-7 TE performances in his last five games. Strange should be locked in as the TE starter going forward for Coen and the Jaguars, making him a solid young TE to roster at only 25 years old.",15
173,KC,Xavier Worthy,WR,11.08,10,22.9,185,509,846,"1,572","The sophomore slump hit Worthy hard in 2025. All of his numbers dropped significantly, and once Rashee Rice debuted in Week 7, Worthy failed to score a TD and was held under double-digit PPR points in eight of his final 10 outings. Additionally, QB Patrick Mahomes tore his ACL, and the Chiefs have several pending free agents in their offense. Worthy looks like a good bet to be one of Kansas City's top two WRs next season, but his immediate value is somewhat clouded by all the question marks surrounding the Chiefs.",15
174,RK,Jadarian Price,RB,9.07,18,22.5,146,369,605,929,"Price is a straightforward power runner who has a third gear for long TDs. He ran for 674 yards and 11 TDs this year while playing behind teammate Jeremiyah Love. Price's agility and ability to work through contact could make him an NFL starter. Price may be a better receiver than his numbers indicate, too.",15
175,SF,Mike Evans,WR,10.10,14,32.6,212,561,825,"1,316","Evans battled injuries in 2025 and lost his 1,000-yard receiving streak. He will turn 33 before next season, so Evans' career is certainly on the downside. That said, he landed in a fine spot for short-term production with the 49ers. They lost 101 targets via offseason departures.",15
176,DEN,Courtland Sutton,WR,11.03,12,30.5,204,536,839,"1,383","Sutton ended 2025 as the WR22 in PPR points per game, benefiting from a high-volume passing attack. He remains locked into the X role for HC Sean Payton, especially after signing a new deal that keeps him with the Broncos through 2029. At 31 in October, however, Sutton's likely closer to a decline than he is to his peak. Jaylen Waddle also arrived in an offseason deal, a move that figures to lower Sutton's target volume.",15
177,TEN,Wan'Dale Robinson,WR,9.02,10,25.3,192,517,829,"1,508","Robinson excelled after Malik Nabers' season ended early in 2025. Robinson finished WR17 in PPR points per game and had his second straight season with 140 targets. He signed with Tennessee in free agency, reuniting him with former HC Brian Daboll (now the Titans' OC). Don't expect 140 targets, but volume shouldn't be an issue in a wide-open Tennessee WR corps.",15
178,RK,Denzel Boston,WR,10.04,18,22.3,174,495,839,"1,636","Boston sat behind the trio of Rome Odunze, Ja'Lynn Polk, and Jalen McMillan in 2023, but the 6'4, 210-pound WR flashed in 2024. He had his best season this year as an X WR, going 63-834-9 on a Huskies team that prioritized the run. Boston is a unique WR in this class with his size, and he should have good workouts too. Expect him to be a top-50 pick.",15
179,DET,Terrion Arnold,DB,N/A,8,23,undefined,385,631,1139,,15
180,GB,Zaire Franklin,LB,N/A,5,29.8,undefined,366,547,810,,15
181,BUF,D.J. Moore,WR,8.05,7,29,195,533,834,"1,410","Moore was inconsistent under new HC Ben Johnson. He ended the season going 50-682-6, his worst fantasy output since 2018. GM Ryan Poles then traded Moore to the Bills in March. The 29-year-old should see greater target stability in Buffalo alongside Josh Allen. A WR2 season is within reach for 2026.",14
182,JAC,Travis Hunter,WR,10.03,8,22.9,100,515,873,"1,703","Just when Hunter finally had his breakout game (8/101/1) against the Rams, he suffered a knee injury in practice that ultimately ended his rookie campaign. That Week 7 game was his only performance with double-digit fantasy points. 37% of Hunter's snaps came as a CB, which will always be a concern. Additionally, the Jaguars traded for (and extended) Jakboi Meyers and also have Brian Thomas Jr. to syphon targets away from Hunter. Volume, usage, and now, injury, are all concerns for Hunter, making him a risk/reward WR3 in his second season.",14
183,PHI,Dallas Goedert,TE,14.04,9,31.3,199,463,712,"1,181","Goedert had a TD-heavy 2025 going 60-591-11. The Eagles schemed up red zone touches for him to score as much as he did, but that may not happen in the future. Goedert is set to be a free agent in 2026, but he is unlikely to find a better situation than the Eagles. He will be 31 heading into the 2026 season and may have peaked in terms of his fantasy output.",14
184,JAC,Bhayshul Tuten,RB,8.11,8,24.2,171,343,532,921,"Tuten carried the Virginia Tech offense for two years after transferring from North Carolina A&T. He showed excellent speed and vision while adding return value. He posted elite numbers at the NFL Combine as the fastest RB in the 40-yard dash, running a 4.32. He also had the best Vertical (40.5""). We saw his burst appear as a rookie, although he never overtook Travis Etienne as the lead back. There's a chance for a larger role in 2026 with Etienne in New Orleans, but the Jags may opt for a committee with Chris Rodriguez and LeQuint Allen.",14
185,CAR,Nic Scourton,DL,40.07,14,21.6,undefined,322,553,1113,,14
186,NO,Bryan Bresee,DL,N/A,11,24.5,undefined,345,572,1011,,14
187,CHI,D'Andre Swift,RB,9.03,5,27.3,222,395,486,666,"Swift's 2023 in Philly proved inconsistent, but he ultimately set career highs in touches and yardage. Chicago provided a fine free agent spot for volume, but a poorly orchestrated offense and a weak O-line limited the fantasy impact. The offensive infrastructure changed alongside new HC Ben Johnson in 2025. As a result, Swift rebounded to finish as the PPR RB14, despite the emergence of Kyle Monangai. The veteran is under contract for one more season.",13
188,PIT,Jaylen Warren,RB,10.08,5,27.4,212,359,521,726,"Najee Harris departed in free agency last spring. But Warren was far from a workhorse after free agent addition Kenneth Gainwell took on a larger-than-expected role. Warren still proved useful with a PPR RB18 finish in 16 games. Gainwell left in free agency, but the Steelers confirmed that they don't want Warren in a workhorse role by signing Rico Dowdle.",13
189,NYJ,Mason Taylor,TE,12.04,9,21.9,168,399,723,"1,427","Taylor saw playing time in his rookie season as the de facto starter for the Jets, although he only mustered 44-369-1. Neck and ankle injuries caused miss games during the season, but his playing time stayed high. While Geno Smith arrived to improve the QB spot, this passing game still profiles as a bottom-five unit.",13
190,LAR,Jared Verse,DL,9.05,8,25.4,undefined,337,566,928,,13
191,NO,Chase Young,DL,N/A,11,27,undefined,348,542,775,,13
192,ATL,Divine Deablo,LB,N/A,5,27.7,undefined,333,515,821,,13
193,TEN,Jeffery Simmons,DL,25.12,10,28.7,undefined,366,542,755,,13
194,TEN,Alontae Taylor,DB,N/A,10,27.3,undefined,382,605,996,,13
195,BUF,Maxwell Hairston,DB,N/A,7,22.7,undefined,380,621,1139,,13
196,KC,Chamarri Conner,DB,N/A,10,25.8,undefined,382,606,1006,,13
197,TB,Jacob Parrish,DB,N/A,9,22.1,undefined,380,630,1190,,13
198,GB,Matthew Golden,WR,11.04,5,22.7,156,485,810,"1,554","Golden had a disappointing rookie season as a first-round WR, finishing 2025 as WR113 in PPR points per game (5.0). Golden couldn't really crack a deep WR group but will get another opportunity in 2026, especially with Romeo Doubs in New England. The second-year pro turns just 23 before next season.",12
199,BUF,Khalil Shakir,WR,13.02,7,26.2,174,495,799,"1,456","Shakir ended last season as WR35 in PPR, with the Bills' inconsistent passing attack hurting his overall output. He's signed through 2029 and should be locked into the slot role moving forward. The issue is that his ceiling took a hit this offseason with the arrival of D.J. Moore. Based on his contract, the former Bear is likely to stick in Buffalo for at least two seasons.",12
200,SEA,Zach Charbonnet,RB,10.06,8,25.3,110,381,543,694,"Seattle made Charbonnet a surprising Round 2 pick, and his usage was predictably limited alongside Kenneth Walker in 2023. A 2024 breakout never truly came, although he showed workhorse potential in games missed by Walker. OC Klink Kubiak favored Charbonnet at the goal line in 2025, leading to a huge 12 rushing scores. A roadblock hit in the playoffs, as he suffered an ACL tear on January 18. His short-term value not only depends on his rehab trajectory but also on the moves Seattle makes in the backfield. So far, they've only added former Packer Emanuel Wilson.",12
201,NE,Romeo Doubs,WR,11.12,14,26,191,487,786,"1,432","Doubs continued his high snap counts as a starter in 2025, but the depth of the Packers' pass catchers limited the ceiling. Doubs posted 55-724-6, enough to make him a spot-start WR3/Flex. New England paid up for him in free agency: a 4-year deal with $39 million in total guarantees. He should be the target leader for Drake Maye in 2026.",12
202,RK,Mike Washington Jr.,RB,11.11,18,22.8,127,330,525,931,"Washington finally broke out in his final season after transferring from Buffalo to Arkansas. He is a big, between-the-tackles back who churns his legs to pick up extra yards on every run. He showcased good vision and cutback ability, but didn't display much big-play upside. There's a chance he gets into Round 3 of the NFL Draft.",12
203,RK,Jonah Coleman,RB,12.02,18,22.6,144,348,548,771,"Coleman scored 17 total TDs this season as the focal point of the Washington offense. He is on the shorter end, but at 220 pounds, Coleman is a punishing rusher with a low pad level. He is also a strong receiver for his size. Coleman didn't test at the Combine, but nobody will mistake him for a burner. Round 3 draft capital would be a nice outcome here.",12
204,SEA,Devon Witherspoon,DB,N/A,8,25.3,undefined,377,597,1028,,12
205,CHI,T.J. Edwards,LB,N/A,5,29.7,undefined,335,501,742,,12
206,ARI,Will Johnson,DB,N/A,8,23,undefined,379,620,1121,,12
207,NO,Kaden Elliss,LB,N/A,11,30.8,undefined,345,505,721,,12
208,ATL,Xavier Watts,DB,N/A,5,24.3,undefined,367,604,1081,,12
209,UNS,David Njoku,TE,16.06,18,29.8,148,451,756,"1,166","Njoku split time early in the season with rookie Harold Fannin Jr., but the writing was on the wall in the final year of his contract. Njoku eventually slotted behind Fannin and finished the season with 33-293-4. He enters his age-30 season looking for a new team.",11
210,NO,Juwan Johnson,TE,12.09,11,29.6,192,450,701,"1,128","Johnson had a career year in 2025, posting 74-828-3 on 97 targets during the fantasy season. With Shough showing promise as the starter, Johnson should retain streaming value in the short term. We're not concerned with the arrival of Noah Fant via free agency.",11
211,TB,Chris Godwin,WR,12.08,9,30.1,190,510,788,"1,281","Godwin suffered a dislocated ankle that cost him most of the 2024 season. He returned a few weeks into the 2025 season but finished WR54 in PPR points per game. Godwin, now 30, should have a larger role in 2026 with Mike Evans in San Francisco.",11
212,NE,Rhamondre Stevenson,RB,12.01,14,28.1,188,334,521,706,"Stevenson was held back by a poor O-line and fumbles in 2024. Then in 2025, his workload predictably dipped following the arrival of TreVeyon Henderson. However, the veteran still posted the second-best PPR points per game tally of his career (12.9). Stevenson is under contract for three more seasons.",11
213,JAC,Jakobi Meyers,WR,11.07,8,29.4,205,521,790,"1,194","Meyers moved from the Raiders to the Jaguars at the 2025 trade deadline, and he instantly excelled in HC Liam Coen's offense. Meyers' success led to the team signing him to a 3-year, $60 million contract extension. We'll see how the team deploys Travis Hunter, but Meyers' deal and production say he's a strong contender to lead this unit in 2026.",11
214,CAR,Chuba Hubbard,RB,10.11,14,26.8,169,348,505,703,"Hubbard set career highs with 250 carries, 1,195 yards, and 10 TDs in 2024. Carolina rewarded him with a contract extension that November, but 2025 wasn't as fantasy-friendly. New Panther Rico Dowdle became a major backfield piece, limiting Hubbard to an RB38 PPR finish. Just note: Dowdle left for Pittsburgh in free agency. We'll see if Carolina adds another RB to join Hubbard and former Round 2 pick Jonathon Brooks.",11
215,BAL,Mark Andrews,TE,13.09,7,30.6,169,443,702,"1,209","Andrews signed a three-year extension with the Ravens during the 2025 season, locking him into the team for the foreseeable future. With Isaiah Likely out of town, Andrews should be able to gain TE1 value in the short term. Note that 2026 will be his age-31 season.",11
216,ARI,Tyler Allgeier,RB,11.01,8,26,143,332,520,832,"Allgeier has proven effective as an early-down thumper, but Bijan Robinson capped the fantasy ceiling in Atlanta. He’s now out of Bijan’s shadow in Arizona, though the offensive environment looks worse. Allgeier is under contract through the 2027 season.",11
217,RK,Emmett Johnson,RB,14.01,18,22.5,116,338,549,833,"Johnson was a 2026 surprise. He ran for 1,451 yards and 12 TDs, averaging 5.78 yards per carry. He has also caught 85 passes over the last two years. Johnson can be a PPR difference maker with his pass-catching and shiftiness in the open field. He weighed in at just 202 pounds at the NFL Combine, but Johnson can be a lead back in the right offense.",11
218,JAC,Parker Washington,WR,10.02,8,24,199,456,778,"1,416","Washington was successful when injuries hit the Jaguars' WR corps. Including the postseason, he ended 2025 with four straight games of 9+ targets and 87+ yards. He'd benefit from the Jags making Travis Hunter anything close to a full-time DB. Still, there's starting-caliber talent in the WR room with Jakobi Meyers and Brian Thomas Jr. The Jags signed Meyers to an extension through the 2028 season.",11
219,NE,Hunter Henry,TE,15.07,14,31.3,193,444,683,"1,133","Henry went 55-712-7 during the 2025 fantasy season, living on his ability to score TDs. He turns 32 during a contract season in 2026 but remains a short-term streamer.",11
220,NE,Robert Spillane,LB,N/A,14,30.3,undefined,333,498,739,,11
221,JAC,Travon Walker,DL,N/A,8,25.3,undefined,323,543,890,,11
222,JAC,Josh Hines-Allen,DL,N/A,8,28.8,undefined,363,489,682,,11
223,PHI,Jalyx Hunt,DL,541.04,9,25.1,undefined,323,543,890,,11
224,ARI,Michael Wilson,WR,8.07,8,26.1,180,492,780,"1,330","Wilson had a marvelous late-season surge when Marvin Harrison Jr. went down and Jacoby Brissett started at QB. He ended 2025 at WR10 in PPR, going 78-1006-7. We're not doubting the talent here. But the issue is the outlook for Wilson when this offense is healthy. He's also entering a contract season.",10
225,HOU,David Montgomery,RB,9.12,6,28.8,178,320,480,807,"Montgomery's rushing yardage (716), TD output (8), and catch total (24) regressed in 2025. This, despite appearing in 17 games for the first time in his career. Ultimately, Montgomery's best fantasy days are behind him. He's signed through 2027.",10
226,LAR,Blake Corum,RB,11.05,8,25.3,128,341,520,799,"Corum's rookie year came and went without much fanfare, as Kyren Williams remained a workhorse. Corum also suffered a broken forearm in January of 2025. The good news is that he earned a rotational role last fall, leading to a 145-746-6 rushing line. We expect a similar role in '26.",10
227,GB,Jayden Reed,WR,12.03,5,25.9,187,488,770,"1,313","Reed only played seven games in 2025 due to multiple injuries, so he never broke out for a deep WR group. When active, he tallied only two top-36 fantasy finishes. 2026 turns up a contract season -- and a thinned-out WR corps following the departure of Romeo Doubs.",10
228,TEN,Tyjae Spears,RB,16.10,10,24.8,158,312,484,838,"Spears looked like a 2024 breakout candidate...until Tennessee signed Tony Pollard, who held lead-back duties. That trend continued in '25, although Spears held a clear pass-catching role with 45 catches. 2026 turns up a contract season.",10
229,HOU,Woody Marks,RB,12.10,6,25.3,127,328,501,845,"Marks profiled as the ideal receiving back with over 1,400 career receiving yards in college. He is an average athlete, but ran a ton of routes at both Mississippi State and USC. However, as a rookie, Marks caught only 24 passes in 16 games. His rushing volume spiked to 196 attempts, as Nick Chubb remained underwhelming and Joe Mixon never suited up due to a foot injury. Houston added a veteran upgrade in David Montgomery over the winter, capping Marks' short-term ceiling.",10
230,KC,Travis Kelce,TE,15.01,10,36.5,215,465,644,"1,038","With the Chiefs' offense taking a step back in 2005, Kelce felt the sting. He finished with 73-839-5 on his fantasy season, his lowest reception total since 2015. In March, we learned that he'd return for his 14th season in Kansas City. He's now year-to-year, making him a shaky dynasty asset.",10
231,TEN,Tony Pollard,RB,14.11,10,28.9,162,346,506,645,"Pollard earned the franchise tag in March of '23, then watched Dallas release veteran Zeke Elliott. Still, coming off a January fibula fracture, Pollard took a major step back. Pollard rebounded in 2024, outplaying Tyjae Spears and playing through injuries to post his third straight 1,000-yard season. Pollard closed the '25 season strong but struggled with consistency on a bottom-five offense. 2026 turns up a contract year.",10
232,LAC,Quentin Johnston,WR,11.02,12,24.6,196,456,747,"1,397","Johnston proved 2024 wasn't a fluke. He matched his eight TDs and set career-best marks in receiving yards (735) and PPR points per game (12.4). He did so despite ranking just 41st league-wide in target share (19%). We'll see how he fits in new OC Mike McDaniels' offense, but there's room for an expanded role with Keenan Allen likely moving on.",10
233,HOU,Dalton Schultz,TE,15.06,6,29.8,186,442,688,"1,108","Schultz had one of his best years in 2026, going 78-704-3 during the fantasy season. He posted the most targets of his career at 106. Schultz is locked into the Texans and QB C.J. Stroud for one more season. He should be a suitable low-end TE1 for 2026, but the future is cloudy beyond that.",10
234,LAC,Tre Harris,WR,14.09,12,24.1,131,481,796,"1,425","Harris struggled to crack the lineup early in his rookie season with Ladd McConkey, Keenan Allen, and Quentin Johnston in front of him. Harris' usage at least increased late in the year, while Allen's departure sets the stage for most consistent usage. Allen leaves behind 122 targets.",10
235,IND,Josh Downs,WR,12.06,11,24.7,172,454,775,"1,410","Downs flashed again in 2025, but being stuck in the slot role continued to limit his ceiling. Downs ended the season going 58-566-4 with his best games coming with Daniel Jones at QB. With Jones back in Indy and Michael Pittman in Pittsburgh, Downs should have a chance to play in more 2-WR sets. This fall turns up a contract season.",10
236,CHI,Kyle Monangai,RB,9.08,5,24.1,149,309,478,839,"Monangai posted two straight 1,200+ rushing yard seasons for a Rutgers offense that worked through him. His college tape showed a tough runner with a low pad level who works well through contact. Has also flashed on some outside runs. Those traits appeared with the Bears, as he quickly entered a timeshare with D'Andre Swift. Monangai looks poised to retain a rotational role for a young, high-upside offense in 2026.",10
237,TEN,Cody Barton,LB,N/A,10,29.4,undefined,329,500,759,,10
238,SEA,Byron Murphy II,DL,542.11,8,23.6,undefined,310,513,907,,10
239,DEN,J.K. Dobbins,RB,12.11,12,27.3,170,319,453,759,"2024 marked Dobbins’ return from an Achilles tear. He slowed down after a hot start, ultimately missing four games with an MCL sprain. In Denver, the 26-year-old landed in a fine spot for 2025 opportunity. But he suffered a notable injury again, this time a Lisfranc injury that required surgery. He signed a new deal with the Broncos in March, but durability concerns remain.",9
240,MIN,Jordan Mason,RB,14.12,6,26.8,153,330,489,719,"Mason recorded 4.8 YPC on 159 attempts as a first-year Viking. He was a non-factor in the passing game (14 catches, 51 yards). His short-term upside remains limited with Aaron Jones returning for another season.",9
241,TB,Kenneth Gainwell,RB,13.03,9,27.1,152,317,503,730,"Gainwell was lightly used behind Saquon Barkley in 2024. The former Eagle then joined a Pittsburgh squad that watched Najee Harris sign with the Chargers. Surprisingly, Gainwell went on to pace the Steelers with a stunning 73 catches. Now, he'll push Bucky Irving for snaps and touches after signing a two-year deal in March.",9
242,ARI,Trey Benson,RB,13.12,8,23.7,117,329,513,794,"Benson’s college career started ominously with a multi-ligament knee tear at Oregon (2020). Transferring to Florida State in 2022, the 6’0, 216-pounder showcased an ideal blend of power and speed. That carried over to the Combine, where he posted an elite 9.78 Relative Athletic Score. He entered the league with plenty of tread on his tires after tallying 156 and 154 carries over his final two college seasons, but a healthy James Conner limited the rookie’s impact. Then in 2025, Benson missed all but 4 games with a knee injury. He'll break in a new coaching staff in 2026 and needs to earn a backfield role.",9
243,TB,Jalen McMillan,WR,13.06,9,24.3,154,454,774,"1,409","McMillan missed most of 2025 with a neck injury, but he returned late to post 7-114-0 against the Dolphins. His short-term outlook improved significantly after Mike Evans signed a multi-year deal in San Francisco.",9
244,RK,Chris Bell,WR,16.07,18,22.1,145,451,764,"1,470","Bell has been at Louisville his entire career and has shown improvement every season over his four years. He is a hefty 220 pounds and can box out defenders to make contested catches. He went 72-917-6 last season, including a dominant 9-136-2 game against Miami. Bell profiles as a No. 2 WR in the NFL who can flash for some big games.",9
245,WAS,Chigoziem Okonkwo,TE,15.11,12,26.6,160,439,679,"1,170","Okonkwo posted five top-12 fantasy finishes in 2025, his final year in Tennessee. He set career highs in targets (79), catches (56) and yards (560) but remained an underwhelming TD producer (2). He also played all 17 games for the fourth straight season. In Washington, he'll have a chance to boost production for an offense that's moving on from Zach Ertz.",9
246,DAL,Donovan Ezeiruaku,LB,N/A,10,22.5,undefined,289,487,925,,9
247,DEN,Talanoa Hufanga,DB,N/A,12,26.2,undefined,360,564,936,,9
248,CAR,Trevon Moehrig,DB,N/A,14,26.8,undefined,369,577,923,,9
249,WAS,Mike Sainristil,DB,N/A,12,25.5,undefined,368,572,987,,9
250,MIN,T.J. Hockenson,TE,14.05,6,28.8,183,432,671,"1,131","Hockenson's best days are behind him as he heads into his age-29 season. The Vikings at least added talent at QB, signing Kyler Murray after enduring a brutal 2025 under J.J. McCarthy.",8
251,WAS,Jacory Croskey-Merritt,RB,13.04,12,25,122,312,478,806,"A dispute over eligibility limited Croskey-Merritt to only one game in 2024. But he flashed NFL potential in 2023 at New Mexico with 189-1,190-17. Sure enough, he showed it as a rookie. With Brian Robinson and Austin Ekeler out, JCM tallied 805 yards and 8 TDs on 175 attempts. Despite some bright moments, we expect Washington to add a backfield piece this offseason.",8
252,KC,Justin Fields,QB,18.12,10,27.1,19,584,935,"1,598","Down-to-down inconsistency remained after signing with the Jets, as Fields was eventually benched for Tyrod Taylor. Fields will likely find a backup job in 2026.",8
253,LAR,Terrance Ferguson,TE,14.07,8,23.1,124,413,704,"1,308","Ferguson showed a late-season surge with Davante Adams sidelined. The Rams seem intent on using the young TE as a pseudo WR, which is great for his fantasy potential. Still, uncertainty at QB and a crowded TE depth chart mean dynasty managers will need patience.",8
