Rank,Team,Player,Fantasy Position,ADP,Bye,Age,1yr. Proj,3yr. Proj,5yr. Proj,10yr. Proj,DS Analysis,3D Value +
1,BUF,Josh Allen,QB,1.01,7,29.8,undefined,1106,1799,3411,"Despite a weak pass-catching corps, Allen led all QBs in fantasy points per game in 2025. At 30, Allen’s run of elite play should continue for the foreseeable future. He gets a nice boost with the addition of D.J. Moore, who should stick around for at least the next two seasons.",100
2,KC,Patrick Mahomes,QB,3.02,10,30.6,undefined,1031,1684,3262,"Mahomes posted underwhelming production in 2024, ultimately finishing as the QB11. When healthy in 2025, he lacked consistency from week to week. Instead, he relied on rushing stats to finish as a top-5 fantasy QB pre-injury. Unfortunately, he suffered a December ACL/LCL tear that puts his availability for Week 1, 2026, in question.",81
3,CIN,Joe Burrow,QB,1.10,10,29.3,undefined,1032,1668,3154,"Burrow performed as a high-end QB1 in 2024. He was also one of the offseason winners in 2025, as Cincy retained WRs Ja’Marr Chase AND Tee Higgins on long-term deals. Then came a disastrous '25 season that was thrown off track by a Week 2 turf toe injury. Fortunately, Burrow returned and flashed his high-end upside on a couple of occasions. He should have multiple years of top-8 production remaining.",81
4,CLE,Carson Schwesinger,LB,9.03,9,23.1,undefined,806,1333,2497,,81
5,BAL,Lamar Jackson,QB,1.11,7,29.3,undefined,1021,1666,2923,"Jackson posted an MVP-caliber 2024, resulting in a career-high 488 fantasy points. But injuries to his back and hamstring severely limited his fantasy output in 2025. In fact, Jackson delivered only three top-5 fantasy finishes -- each over the first three weeks of the season. Jackson is a bounce-back candidate for 2026, his age-29 season.",74
6,NE,Drake Maye,QB,1.03,14,23.6,undefined,946,1601,3199,"Well-built at 6’4, 230, Maye showed he could make any throw on the field as a rookie. Then, alongside an upgraded O-line and an improved WR corps, Maye’s play reached elite levels in 2025. He ranked top five in passing TDs, passing yards, yards per attempt, and passing success rate. His arrow is pointing straight up ahead of Year 3.",72
7,ATL,Bijan Robinson,RB,1.02,5,24.2,undefined,759,1221,2052,"With OC Arthur Smith out of town, Robinson's production exploded to 1,881 total yards and 15 TDs in 2024. While his TD count dropped in 2025, he still posted a career-high 22.0 PPR points per game. He also played all 17 games for the third straight season. At only 24, Bijan should remain an elite fantasy option for the foreseeable future.",72
8,TEN,Cedric Gray,LB,25.10,10,23.4,undefined,724,1196,2241,,71
9,WAS,Jayden Daniels,QB,1.08,12,25.3,undefined,993,1617,3018,"Daniels proved pro-ready as a rookie, throwing for 3,568 yards, 25 TDs, and 9 INTs on a 69% completion rate. His 891 rushing yards ranked second among QBs. Washington added useful pieces in the '25 offseason, including WR Deebo Samuel and LT Laremy Tunsil, but a pair of elbow injuries ultimately derailed the QB's season. At only 25, Daniels is a prime rebound candidate for 2026 and beyond.",70
10,LAC,Justin Herbert,QB,2.12,12,28.1,undefined,964,1576,3059,"Alongside new HC Jim Harbaugh, WR Ladd McConkey, and LT Joe Alt, Herbert played excellent real-life ball in 2024. However, he finished as a QB1 in only five of 17 games. The team added back Keenan Allen in 2025, plus spent early picks on RB Omarion Hampton and WR Tre Harris. The team even saw a quick rise from Round 5 TE Oronde Gadsden II. Herbert ultimately delivered a fine fantasy season with help from boosted rushing volume. But an injury-ravaged O-line and another Herbert injury -- this time to his hand -- limited what could have been an even better season. With plenty of talent around him, Herbert remains an upside QB1 alongside new OC Mike McDaniel.",67
11,DET,Jahmyr Gibbs,RB,1.05,8,24,undefined,711,1127,1800,"Despite a slow start, Gibbs largely delivered as a rookie RB. He averaged 5.2 YPC and popped in 10 TDs on 182 attempts, adding 52 receptions. His production reached new heights in 2024, and he proved more than capable as a workhorse back following a late-season injury to David Montgomery. 2025 turned up much of the same, as he finished as the PPR RB3 even with a few late-season duds. The former Round 1 pick is now eligible for a contract extension.",65
12,RK,Jeremiyah Love,RB,2.06,18,20.8,undefined,667,1110,2077,"Love has been a force, posting back-to-back 1,100-yard rushing seasons with 35 total rushing TDs. His contact balance and power rank among the best RB traits in recent draft classes, and his profile stacks up favorably with Ashton Jeanty’s. That’s especially impressive given Jadarian Price’s presence as another top back in this class. Love brings true three-down upside and will be just 21 years old as a rookie.",64
13,CIN,Ja'Marr Chase,WR,1.04,10,26.1,undefined,683,1108,2046,"Chase took a slight step back after his 2024 triple crown, but Joe Burrow’s extended absence shaped much of that dip. Even so, Chase still finished WR3 in PPR points per game at 19.7. That number felt much closer to his floor than his ceiling. As long as Burrow stays healthy, Chase will push for the top WR spot each year for the foreseeable future. He's only 26 years old.",64
14,RK,Sonny Styles,LB,13.02,18,21.3,undefined,639,1104,2223,,64
15,LVR,Ashton Jeanty,RB,2.05,8,22.3,undefined,638,1053,1837,"Jeanty went from a 1,900-yard sophomore season to a 2,700-yard junior season. His college tape showed elite contact balance, burst, and receiving ability. Arriving as the sixth overall pick, Jeanty showed elite flashes, most notably in a Week 16 game at Houston. Overall, Jeanty's effectiveness was limited by poor O-line and QB play. 2026 will bring major offensive changes, although Jeanty still projects as a workhorse.",60
16,SEA,Jaxon Smith-Njigba,WR,1.07,8,24.2,undefined,618,1007,1860,"JSN took another step forward in his third season, finishing as WR2 in PPR points per game (21.3). Even on a Seahawks offense that wanted to lean on the run, JSN remained dominant. His route running and athleticism leave him open on most passing plays, which led to 163 targets from Sam Darnold. At only 24 years old, JSN is one of the top players in dynasty.",57
17,PHI,Jalen Hurts,QB,3.01,9,27.7,undefined,961,1538,2627,"Hurts set a career-high in passing TDs in 2025. However, his rushing production took a hit, leading to a career low in fantasy points per game. Hurts did manage to avoid missing time after a concussion cost him two games in 2024. He'll also enter 2026 with A.J. Brown, DeVonta Smith, and Saquon Barkley under contract. Dallas Goedert is slated for free agency.",57
18,HOU,Nico Collins,WR,3.10,6,27.1,285,804,"1,303","2,407","Collins finished WR11 in PPR points per game in 2025 (15.1). Houston's struggles on offense made for a volatile season, but Collins came on late with C.J. Stroud and Davis Mills. He was a top-12 WR in a struggling offense, so the potential for even better results exists over the next few years. Collins is under contract through the 2027 season.",57
19,JAC,Trevor Lawrence,QB,3.07,8,26.5,333,884,"1,456","2,832","A shoulder injury limited Lawrence to only 10 games in 2024. Then in 2025, he rebounded tremendously under new HC Liam Coen. Lawrence tallied 4,007-29-12 -- plus nine rushing TDs. That propelled him to an overall QB4 fantasy finish. Lawrence's huge season came despite only seven games alongside rookie WR Travis Hunter. We also saw WR Brian Thomas Jr. take a major step back. Veteran Jakobi Meyers stepped up following a mid-season trade, as the team extended him through the 2028 season. Regardless of the pieces, Lawrence's stock is clearly on the rise.",57
20,LAC,Omarion Hampton,RB,2.09,12,23.1,undefined,640,1008,1714,"Hampton carried the North Carolina offense for two years -- 2023-2024 -- including one year when Drake Maye was the QB. The former four-star recruit tallied two straight years of 1,500+ rushing yards and 15 TDs, and he adds solid receiving potential. A shifty runner who can hit the home run, Hampton showed his athleticism by crushing the Combine with a 4.48 40-yard dash and a 38"" vertical. While he landed in a dreamy spot with HC Jim Harbaugh and the Chargers, Hampton made only nine appearances due to an ankle fracture. If healthy, an RB1 season is in reach for '26 and beyond.",57
21,MIN,Justin Jefferson,WR,2.04,6,26.8,undefined,628,1019,1867,"The 2025 season marked a low point for Jefferson, at least by his standards. He finished WR31 in PPR points per game at 11.9 while dealing with a three-man QB rotation of JJ McCarthy, Carson Wentz, and Max Brosmer. Jefferson still reached 1,000 receiving yards again, stretching that streak to seven seasons. He remains in the thick of his prime. Plus, Kyler Murray arrived in March to bolster the QB room.",57
22,LAR,Puka Nacua,WR,1.06,8,24.8,undefined,591,968,1811,"Nacua delivered a career year in 2025, finishing as the PPR WR1 with 377 fantasy points. Matthew Stafford fed him 166 targets, making Nacua the clear centerpiece of the Rams’ passing game. At 24, he remains locked in as one of dynasty’s top WRs. The one thing keeping him from the top overall spot is the long-term uncertainty at QB.",56
23,DAL,CeeDee Lamb,WR,2.07,10,27,undefined,609,983,1790,"Lamb shared the spotlight with George Pickens, but he was still productive. He finished 2025 as WR10 in PPR points per game at 15.5. Lamb did have a short stint on IR after an AC joint sprain, but he remains an upside fantasy asset when healthy. At only 26, Lamb should be a fantasy mainstay for a long time.",55
24,NE,TreVeyon Henderson,RB,4.06,14,23.4,203,680,"1,075","1,775","Henderson was highly recruited and showed top-end traits at Ohio State, particularly his burst and pass-catching ability. He ran as expected at the Combine with a 4.43 40-yard dash and tied for second among RBs with a 1.52 10-yard split. Henderson appeared in all 17 games as a rookie but wasn't a major contributor until midseason. (He finished as a top-25 PPR back in seven of his final nine games.) An elite QB and an improved O-line only add value here.",54
25,LVR,Brock Bowers,TE,2.01,8,23.3,undefined,598,973,1734,"Bowers disappointed in 2025 while dealing with a knee injury. He only played in 12 games and finished with 64-680-7 receiving. The talent is still undeniable, and Bowers should rebound alongside Fernando Mendoza in 2026.",54
26,IND,Jonathan Taylor,RB,3.03,11,27.3,307,699,"1,025","1,423","Taylor missed three games in 2024 but remained busy on a per-game basis, averaging 23 touches. The former Round 2 pick then went off for a HUGE 2025 that included 323 carries, 1,585 yards, and 18 TDs. He added a career-high 46 catches and 378 yards. Now, Taylor's huge career workload makes him a candidate for an early decline. In the short-term, though, this Indy offense should remain centered on the run. JT is signed for one more season.",54
27,DET,Amon-Ra St. Brown,WR,1.09,8,26.4,undefined,589,949,1728,"The Lions faltered in 2025, but St. Brown kept producing. He ranked fourth in PPR points per game at 19.1. He also ranked second in the league in targets at 172. St. Brown and Jared Goff are both signed through the 2028 season.",53
28,MIA,De'Von Achane,RB,2.08,12,24.5,undefined,614,948,1515,"Achane's rushing efficiency hit a snag in 2024. But his receiving work went through the roof: 78 catches, 592 yards, and 6 TDs. Another easy RB1 season surfaced in 2025, although he'll now hit Year 4 alongside a new QB and HC -- and a rebuilding roster.",53
29,ARI,Trey McBride,TE,2.03,8,26.3,undefined,574,934,1736,"McBride had a dominant 2025, breaking the single-season TE receptions record in Week 17. His fantasy season ended at 119-1174-11. QB play is a minor issue in the short term, but there's no doubt McBride remains an elite dynasty TE.",53
30,NYG,Malik Nabers,WR,1.12,14,22.7,undefined,573,970,1893,"A 25-target start over the first two games hinted at a huge 2025 for Nabers. Then a torn ACL cut the year short. The injury could cap his early-season impact in 2026, but the long-term dynasty outlook still looks strong. Nabers remains a premium talent tied to rising QB Jaxson Dart.",53
31,GB,Edgerrin Cooper,LB,N/A,5,24.4,undefined,579,935,1697,,53
32,ATL,Drake London,WR,2.10,5,24.7,undefined,571,939,1797,"London started the season hot but missed four games with a PCL strain. He still ended as the WR8 in PPR points per game at 16.8. Atlanta's current WR corps suggests another high-volume role in 2026. Only 25, London projects as a long-term WR1.",52
33,PHI,Jihaad Campbell,LB,N/A,9,22.1,undefined,555,938,1813,,52
34,DET,Jack Campbell,LB,N/A,8,25.6,undefined,575,910,1551,,52
35,CHI,Caleb Williams,QB,2.02,5,24.4,undefined,874,1452,2831,"Williams showed the ability to make high-end throws as a rookie. But his tendency to hold the ball and take sacks led to a wildly inconsistent campaign. Fortunately, an improved O-line and an upgraded pass-catching corps arrived last offseason and immediately paid dividends. TE Colston Loveland and WR Luther Burden really showed promise and supply long-term building blocks. Williams should only improve as he gains time in HC Ben Johnson's system.",51
36,CHI,Colston Loveland,TE,3.05,5,22,283,707,"1,184","2,273","Loveland flashed elite potential in 2025, especially after a late-season injury to Rome Odunze. With DJ Moore off to Buffalo, Loveland's role should only grow in 2026 and beyond. He'll play his second season at only 22 years old.",51
37,NYJ,Jamien Sherwood,LB,N/A,9,26.3,undefined,572,906,1543,,51
38,IND,Tyler Warren,TE,4.02,11,23.8,272,703,"1,160","2,189","Warren's 2025 was a tale of two seasons. He dominated for the first half of the year, achieving top-5 TE numbers in PPR. But an injury to Daniel Jones led to an awful late-season surge for the rookie. Zooming out, the future still looks bright here, especially after the trade of Michael Pittman. Warren should be a featured part of the passing game moving forward.",49
39,CLE,Harold Fannin Jr.,TE,4.10,9,21.7,252,635,"1,168","2,410","Fannin not only took over the No. 1 TE spot -- he became the No. 1 offensive weapon for the Browns. He ended the 2025 fantasy season 72-731-6 on 107 targets, and that was playing with three different QBs. He enters 2026 at age 22 with his best days ahead.",49
40,KC,Nick Bolton,LB,N/A,10,26.1,undefined,550,871,1484,,48
41,SF,Brock Purdy,QB,3.12,14,26.3,329,858,"1,407","2,697","Purdy missed a chunk of early-season games with turf toe. But he rebounded to finish as the QB4 in total points from Week 11 on. Purdy benefits from HC stability and a solid group of pass catchers, although Christian McCaffrey and George Kittle are likely nearing the end of their prime. San Francisco also added veteran Mike Evans on a multi-year deal. Purdy is under contract through the 2030 season.",47
42,NYG,Jaxson Dart,QB,2.11,14,22.9,319,830,"1,408","2,786","Dart flashed his arm talent as a true freshman at USC, but he was fully unlocked in 2024 at Ole Miss. He completed 69.3% of his passes for 4,279 yards, 29 TDs, and 6 INTs. With a quick release and improved coverage recognition, Dart quickly showed the potential to stick as an NFL starter. He also adds plenty of mobility to make a fantasy impact moving forward. While durability issues persist, Dart certainly carries top-10 potential if the Giants continue upgrading the offense.",46
43,CAR,Tetairoa McMillan,WR,3.04,14,23,226,708,"1,199","2,339","McMillan enjoyed a successful first season, finishing as the WR23 in fantasy points per game (12.6). The Panthers went run-heavy under QB Bryce Young, who struggled to provide consistency in the passing game. Still, McMillan was the clear No. 1 for a team short on receiving depth. He flashed excellent body control and improved as the season went on. There is star-level, top-tier potential with McMillan, who's only 23 years old.",45
44,KC,Rashee Rice,WR,5.04,10,25.9,308,702,"1,146","2,108","Rice started 2025 with a six-game suspension and ended the season on IR with a concussion. In his eight games, he was consistently targeted by Patrick Mahomes, finishing as the WR5 in PPR points per game (18.5). Outside of injury risk, Rice appears to be the clear No. 1 WR on the Chiefs, and the scheme has been built to utilize his talents. We'll see what comes of his off-field issues, which include domestic abuse allegations.",44
45,BUF,James Cook,RB,3.06,7,26.5,287,620,893,"1,315","Cook erupted for a massive 18 total TDs in 2024. He posted another 14 scores this past fall, also supplying a career-high 1,621 rushing yards in 17 games. He inked a contract extension last August, keeping him under team control through the 2029 season.",44
46,DAL,George Pickens,WR,3.08,10,25.1,262,706,"1,157","2,174","Coming off his best season (93-1,429-9), the Cowboys applied the franchise tag to Pickens in February. A long-term extension in Dallas might be the best-case scenario for Pickens' dynasty value. Just entering his prime, Pickens is an ascending talent with a ton of fantasy appeal.",43
47,GB,Jordan Love,QB,5.01,5,27.4,288,887,"1,431","2,550","In 2025, Love missed two games for the second straight season. When healthy, he flashed with three overall QB2 fantasy finishes. However, he tallied only one other finish inside the top-10. Overall, Love’s volume continued to stay low relative to his breakout 2023. Green Bay also remains without a true No. 1 WR, although it’s a huge positive that Christian Watson has looked strong in his return from an ACL tear. Romeo Doubs joined New England in free agency, putting more pressure on Matthew Golden's development. Love is under contract through the 2028 season.",43
48,DEN,Bo Nix,QB,3.09,12,26.1,316,856,"1,395","2,603","As an older prospect at 24, Nix proved pro-ready alongside HC Sean Payton. Across 17 games, he tallied 3,775-29-12 -- plus 430-4 rushing. The 2025 offseason brought the arrival of veteran TE Evan Engram and Round 3 WR Pat Bryant, along with a new deal for Courtland Sutton. While Nix's play proved inconsistent, he still finished QB7 on a league-high 612 attempts. He also added 5 rushing TDs and finished tied for fifth in QB rush attempts. That aspect of Nix's game helps buoy his dynasty value.",42
49,SEA,Ernest Jones,LB,N/A,8,26.3,undefined,511,809,1378,,42
50,SEA,Nick Emmanwori,DB,33.12,8,22.2,undefined,594,974,1859,,42
51,TB,Emeka Egbuka,WR,4.01,9,23.5,220,664,"1,171","2,328","Egbuka got off to a hot start, averaging 16.1 PPR points per game and ranking inside the top-10 WRs in the first 10 weeks of his rookie season. However, he would only top 50 yards once and didn't score a TD in Tampa's final eight games. Those first 10 games show Egbuka's potential. With Mike Evans leaving as a free agent, Egbuka will be in a position to open his sophomore campaign as the Buccaneers' No. 1 WR. While Baker Mayfield returns, the Bucs brought in a new OC in Zac Robinson.",41
52,GB,Tucker Kraft,TE,5.10,5,25.4,228,634,"1,033","1,946","Kraft enjoyed a strong 2025 before a November ACL tear cost him his season. He ended the year going 32-489-6 in only 8 games. He not only flashed good hands, but Kraft also showed after-the-catch ability in his third season. He remains a young TE on an offense that loves to use the position. The 25-year-old is a top dynasty TE moving forward.",41
53,RK,Fernando Mendoza,QB,4.03,18,22.5,207,838,"1,411","2,828","Mendoza posted two straight 3,000-yard passing seasons at Cal and Indiana and is slated to join Vegas in the NFL Draft. He displays a strong arm and great mid-range accuracy while showing toughness in the pocket. Mendoza can scramble some too, which should help his fantasy output. He lacks the upside of recent top QBs like Caleb Williams, but Mendoza has the potential to be a top-10 fantasy QB.",41
54,KC,Kenneth Walker III,RB,4.11,10,25.4,264,572,871,"1,340","Walker encountered an up-and-down regular season in 2025, limited by Zach Charbonnet's goal line role. When Charbonnet suffered a torn ACL in the postseason, Walker stepped up for a productive run to the Super Bowl. This culminated in a 161-yard, MVP performance. Walker chose an ideal landing spot in free agency, joining a Chiefs offense that no longer rosters Kareem Hunt or Isiah Pacheco.",40
55,LVR,Quay Walker,LB,N/A,8,25.9,undefined,491,778,1325,,39
56,DAL,Dak Prescott,QB,4.08,10,32.7,327,863,"1,421","2,351","Dak’s 2024 was ruined by a hamstring injury that required surgery. But he rebounded with a healthy 2025 to post top-five fantasy totals (4,552 yards, 30 TDs, 10 INTs). We'll see about the status of George Pickens, but expect Dallas to retain him.",38
57,NYJ,Breece Hall,RB,4.12,9,24.8,245,559,852,"1,310","A largely ineffective Aaron Rodgers limited Hall in 2024, while the RB also battled through a knee injury. 2025 turned up even worse QB play, although Hall still posted a career-high 1,065 rushing yards. He returned to the Jets via the franchise tag, while his situation improved a bit with the arrival of Geno Smith. Still, it's reasonable to expect Hall to play elsewhere in 2027 and beyond.",38
58,RK,Kenyon Sadiq,TE,7.09,18,21.1,170,589,"1,015","2,059","Sadiq is an elite athlete who uses his footwork and leaping ability to get open and make catches. He is extremely tough to cover and can box out when contested. He led the Ducks in receptions this year despite numerous drops. Sadiq may not add much as a blocking presence, but he could be a top-15 pick with his ability as a receiver.",38
59,SF,Christian McCaffrey,RB,4.07,14,29.8,331,546,764,"1,237","CMC was excellent in 2023, finishing as the clear-cut RB1. Then came a nightmare 2024 that included multiple lower-body injuries (and only 50 total carries). He rebounded to a PPR RB1 finish in 2025, boosted by a huge 102 catches. Of equal importance: CMC played all 17 games. He'll play next season at 30, signaling some dynasty risk.",38
60,RK,Arvell Reese,LB,N/A,18,20.6,undefined,455,774,1614,,38
61,RK,CJ Allen,LB,N/A,18,21.1,undefined,459,793,1597,,38
62,MIA,Jordyn Brooks,LB,N/A,12,28.4,undefined,491,758,1210,,37
63,NO,Chris Olave,WR,3.11,11,25.8,267,665,"1,085","1,995","For only the second time in his career, Olave made it through 16 games. He capitalized with career highs in catches, yards, and TDs, finishing with a 100-1,163-9 line in Kellen Moore’s offense. The late-season QB play mattered, too: all three of his 100-yard games came with Tyler Shough under center. That combo gives Olave a sturdy setup for his age-26 season. He remains a strong WR2.",36
64,CLE,Quinshon Judkins,RB,5.05,9,22.4,208,534,838,"1,419","Judkins answered questions about his athleticism with a 4.48 40-yard dash at the NFL Combine and tied for second among RBs with a 1.52 10-yard split. His rookie season started nicely, but he was ultimately limited by a poor supporting cast. Judkins' season also ended with a Week 16 fibula fracture and ankle dislocation. Following surgery, he's expected to be ready for training camp, where he should retain lead-back work.",36
65,ATL,Kyle Pitts,TE,7.05,5,25.5,218,589,959,"1,805","Pitts rebounded in 2025, posting career highs in targets (118), catches (88), and TDs (5). He also played all 17 games for the third straight season. Atlanta placed the franchise tag on him over the winter, and we'll see if both sides can agree on a long-term deal.",36
66,PHI,Cooper DeJean,DB,40.02,9,23.2,undefined,546,892,1601,,36
67,CAR,Devin Lloyd,LB,N/A,14,27.5,undefined,471,738,1216,,36
68,LVR,Nakobe Dean,LB,N/A,8,25.3,undefined,465,748,1311,,36
69,LAC,Daiyan Henley,LB,N/A,12,26.4,undefined,472,747,1272,,36
70,RK,Caleb Downs,DB,14.10,18,21.3,undefined,534,877,1709,,35
71,HOU,C.J. Stroud,QB,7.04,6,24.5,285,811,"1,370","2,646","Stroud's fantasy points per game rebounded slightly from 2024 (18.2 vs. 17.0). Still, he wasn't asked to carry a team that fielded one of the NFL's top defenses. That played a part in Stroud posting only three top-12 fantasy finishes in 14 games. Nico Collins, Jayden Higgins, and Jaylin Noel supply a nice group of young weapons. Still, a lack of rushing production -- plus middling pass volume -- figures to stick around moving forward.",34
72,CIN,Tee Higgins,WR,6.01,10,27.3,240,674,"1,076","1,916","2025 was another strong season for Higgins. He topped double-digit TDs for the second consecutive year and ranked as the WR16, averaging 14.0 PPR points per game. However, he missed three games with concussions -- the fourth time in five seasons that he's missed multiple games. The Bengals are running it back in 2026, so Higgins remains an excellent WR2 who should continue to post reliable WR1/2 numbers when healthy.",34
73,TEN,Kevin Winston Jr.,DB,486.01,10,22.3,undefined,520,862,1672,,34
74,BAL,Zay Flowers,WR,6.06,7,25.6,254,664,"1,072","1,872","The Ravens disappointed in 2025, but Flowers still delivered a career year. He posted personal bests in targets (118), catches (86), and yards (1,211) while finishing as a top-10 fantasy WR for the first time. If Lamar Jackson stays healthy, Flowers has a good chance to repeat that level of production in 2026. Baltimore’s lack of pass-catching depth also points to another heavy role. The one variable is how Flowers is utilized in new OC Declan Doyle’s offense.",33
75,PHI,Saquon Barkley,RB,5.08,9,29.2,266,547,799,"1,095","2023 turned up an ugly QB situation and poor efficiency on strong volume. Barkley expressed interest in returning to New York but ultimately joined a superior environment in Philly. From there, he enjoyed a historic 2024 with 2,005 yards and 15 total TDs. 2025 marked a clear step back, as Barkley no longer delivered a steady dose of explosive plays. He's signed for three more seasons.",33
